Sa-By Thai Cuisine|396|3.5|https://s3-media1.fl.yelpcdn.com/assets/2/www/img/5ef3eb3cb162/ico/stars/v1/stars_3_half.png|https://s3-media1.fl.yelpcdn.com/assets/2/www/img/2e909d5d3536/ico/stars/v1/stars_small_3_half.png|https://www.yelp.com/biz/sa-by-thai-cuisine-san-jose-2?adjust_creative=iXFee7diZPAfi_pfPXF7Sg&utm_campaign=yelp_api&utm_medium=api_v2_business&utm_source=iXFee7diZPAfi_pfPXF7Sg|Oh my god this place is delicious! Perfect take out date after a long hard day for my fiancé and I. He looked up Thai food because we were craving it and...|https://s3-media3.fl.yelpcdn.com/bphoto/i27z0UyC0nxpD8frWr62IQ/ms.jpg|+1-408-286-5807|San Jose|CA|95112|346 E William St|37.33186|-121.87758
Sa-By Thai|338|3.5|https://s3-media1.fl.yelpcdn.com/assets/2/www/img/5ef3eb3cb162/ico/stars/v1/stars_3_half.png|https://s3-media1.fl.yelpcdn.com/assets/2/www/img/2e909d5d3536/ico/stars/v1/stars_small_3_half.png|https://www.yelp.com/biz/sa-by-thai-san-jose?adjust_creative=iXFee7diZPAfi_pfPXF7Sg&utm_campaign=yelp_api&utm_medium=api_v2_business&utm_source=iXFee7diZPAfi_pfPXF7Sg|Tried this place out last night. Very good overall. Food was good service was good and food cane out quickly. I'll he back.|https://s3-media2.fl.yelpcdn.com/bphoto/b8slXEguW6mifYhARi7XGg/ms.jpg|+1-408-292-3900|San Jose|CA|95112|404 S 2nd St|37.33052|-121.88452
Hanuman Thai Cuisine|334|3|https://s3-media3.fl.yelpcdn.com/assets/2/www/img/34bc8086841c/ico/stars/v1/stars_3.png|https://s3-media3.fl.yelpcdn.com/assets/2/www/img/902abeed0983/ico/stars/v1/stars_small_3.png|https://www.yelp.com/biz/hanuman-thai-cuisine-san-jose?adjust_creative=iXFee7diZPAfi_pfPXF7Sg&utm_campaign=yelp_api&utm_medium=api_v2_business&utm_source=iXFee7diZPAfi_pfPXF7Sg|Tried this place for dinner while visiting San Jose. I really liked the food. The potions were huge and the prices were great. The quality was good. I had...|https://s3-media4.fl.yelpcdn.com/bphoto/kDJ_YNzmytR6O8f8oz0yrg/ms.jpg|+1-408-286-2482|San Jose|CA|95113|1 E San Fernando St|37.3344757|-121.8891318
Vegetarian House|787|4|https://s3-media4.fl.yelpcdn.com/assets/2/www/img/c2f3dd9799a5/ico/stars/v1/stars_4.png|https://s3-media4.fl.yelpcdn.com/assets/2/www/img/f62a5be2f902/ico/stars/v1/stars_small_4.png|https://www.yelp.com/biz/vegetarian-house-san-jose?adjust_creative=iXFee7diZPAfi_pfPXF7Sg&utm_campaign=yelp_api&utm_medium=api_v2_business&utm_source=iXFee7diZPAfi_pfPXF7Sg|So I was in town looking for a place for a late meal and came across this place. Let me make one thing clear first, I am a carnivore and eat steak all the...|https://s3-media4.fl.yelpcdn.com/bphoto/q840KKWhsY_YoBzSQUNXFQ/ms.jpg|+1-408-292-3798|San Jose|CA|95112|520 E Santa Clara St|37.341312408447|-121.87907409668
Vung Tau Restaurant|1220|4|https://s3-media4.fl.yelpcdn.com/assets/2/www/img/c2f3dd9799a5/ico/stars/v1/stars_4.png|https://s3-media4.fl.yelpcdn.com/assets/2/www/img/f62a5be2f902/ico/stars/v1/stars_small_4.png|https://www.yelp.com/biz/vung-tau-restaurant-san-jose?adjust_creative=iXFee7diZPAfi_pfPXF7Sg&utm_campaign=yelp_api&utm_medium=api_v2_business&utm_source=iXFee7diZPAfi_pfPXF7Sg|We came here on a Friday night around 630pm and were seated right away.Service was good, nothing to complain about there. It was never hard to get the...|https://s3-media2.fl.yelpcdn.com/bphoto/Uej8SYPdeW9pPbQJyZIG-g/ms.jpg|+1-408-288-9055|San Jose|CA|95112|535 E Santa Clara St|37.3417699|-121.87951
Town Cafe|59|4|https://s3-media4.fl.yelpcdn.com/assets/2/www/img/c2f3dd9799a5/ico/stars/v1/stars_4.png|https://s3-media4.fl.yelpcdn.com/assets/2/www/img/f62a5be2f902/ico/stars/v1/stars_small_4.png|https://www.yelp.com/biz/town-cafe-san-jose?adjust_creative=iXFee7diZPAfi_pfPXF7Sg&utm_campaign=yelp_api&utm_medium=api_v2_business&utm_source=iXFee7diZPAfi_pfPXF7Sg|It was late Friday night and we were looking for some Boba & late night snack around downtown SJ. It left us with not much option really so I found Town...|https://s3-media3.fl.yelpcdn.com/bphoto/HRBucZ3bO7UXZH88cJEOHQ/ms.jpg|+1-408-320-4425|San Jose|CA|95113|301 E Santa Clara StUnit A|37.339410748008|-121.88408044647
Tofoo Com Chay|883|4|https://s3-media4.fl.yelpcdn.com/assets/2/www/img/c2f3dd9799a5/ico/stars/v1/stars_4.png|https://s3-media4.fl.yelpcdn.com/assets/2/www/img/f62a5be2f902/ico/stars/v1/stars_small_4.png|https://www.yelp.com/biz/tofoo-com-chay-san-jose-2?adjust_creative=iXFee7diZPAfi_pfPXF7Sg&utm_campaign=yelp_api&utm_medium=api_v2_business&utm_source=iXFee7diZPAfi_pfPXF7Sg|What the place lacks in space, it multiplies in flavor and freshness. A tiny joint located in Santa Clara, TCC doles out just about the bestest vegetarian...|https://s3-media2.fl.yelpcdn.com/bphoto/kpy2GuDkZKY5cOF09Gj2zw/ms.jpg|+1-408-286-6335|San Jose|CA|95113|388 E Santa Clara St|37.340020760894|-121.88238322735
Nomikai|204|4|https://s3-media4.fl.yelpcdn.com/assets/2/www/img/c2f3dd9799a5/ico/stars/v1/stars_4.png|https://s3-media4.fl.yelpcdn.com/assets/2/www/img/f62a5be2f902/ico/stars/v1/stars_small_4.png|https://www.yelp.com/biz/nomikai-san-jose-2?adjust_creative=iXFee7diZPAfi_pfPXF7Sg&utm_campaign=yelp_api&utm_medium=api_v2_business&utm_source=iXFee7diZPAfi_pfPXF7Sg|Service is outstanding, I was here to meet up with a friend. I didn't see her, and when I was walking outside to call her, the waitress came outside to let...|https://s3-media4.fl.yelpcdn.com/bphoto/_Ahsabbm55GvG57Lm7-ciw/ms.jpg|+1-408-287-7199|San Jose|CA|95113|48 S 1st St|37.335285938871|-121.88993498683
